Titre,Entreprise,Lien,Description,Autres
Responsable Administratif et Financier - Korhogo,ASSOCIATION LA VOUTE NUBIENNE,https://www.emploi.ci/offre-emploi-cote-ivoire/responsable-administratif-financier-korhogo-1480969,"L'Association la Voûte Nubienne (AVN) est une organisation de solidarité internationale à but non lucratif qui s'emploie depuis 2000 à diffuser largement la technique de construction de la Voûte Nubienne (VN) en Afrique de l'Ouest . Sa mission est de permettre l'accès à une architecture durable de qualité, pour le plus grand nombre et le plus rapidement possible. Le programme d’AVN est déployé, jusqu’à présent, dans cinq pays : Burkina Faso, Mali, Sénégal, Bénin et Ghana. Il a déjà permis la réalisation de 7 000 chantiers de bâtiments privés et communautaires, au bénéfice de plus de 70 000 bénéficiaires directs, la formation de plus de 1 400 maçons, générant plus de 4 milliards de Francs CFA en...
+plus","Niveau d´études requis : Bac+3, Bac+4 & Bac+5 et plus; Niveau d'expérience : Expérience entre 2 ans et 5 ans et plus; Contrat proposé : CDD; Région de : Korhogo; Compétences clés : Comptabilité - Finance - Gestion"
Chefs Chantier Ouvrage d´Art - Abidjan,GRB,https://www.emploi.ci/offre-emploi-cote-ivoire/chefs-chantier-ouvrage-art-abidjan-1480479,"Nous sommes à la recherche des  Chefs Chantier Ouvrage d'Art. Missions : Assure la signalétique et le balisage du chantier Organise les tâches et les équipes Établit et suit un planning Prévoit et anticipe les besoins matériels et humains à + 48h et à+ 5 jours Est le chef d'orchestre et assure un bon rendement du chantier Représente l'entreprise auprès des différents interlocuteurs S'assure de la qualité des travaux réalisés Fait respecter les consignes sécurité et qualité Renseigne les différents documents nécessaires à la gestion du chantier Est à l'écoute du client dans le respect des procédures internes Établit , signe les rapports journaliers  Établit les comptes flash des...
+plus","Niveau d´études requis : Bac+3, Bac+4 & Bac+5 et plus; Niveau d'expérience : Expérience entre 5 ans et 10 ans & Expérience > 10 ans; Contrat proposé : CDD; Région de : Abidjan; Compétences clés : Construction - Construction d'Ouvrages - Construction Métallique - Gestion du Chantier"
Commerciaux Terrain - Abidjan,BAYANNO SERVICES,https://www.emploi.ci/offre-emploi-cote-ivoire/commerciaux-terrain-abidjan-1480109,"Nous avons besoin des Commerciaux Terrain. Missions : La vente d'essences de parfum dans les communes d'Abidjan sud précisément. 
+plus","Niveau d´études requis : Qualification avant bac & Bac; Niveau d'expérience : Etudiant, jeune diplômé; Contrat proposé : CDI & CDD; Région de : Abidjan; Compétences clés : Animation Commerciale - Vente"
Commercial B2B - Abidjan,GENUKA,https://www.emploi.ci/offre-emploi-cote-ivoire/commercial-b2b-abidjan-1479384,"Nous sommes à la recherche des Commerciaux B2B. Missions : Prospection : Identifier de nouveaux clients potentiels, établir une relation commerciale et prendre rendez-vous. Négociation commerciale : Négocier les conditions de vente, les prix et les contrats. Vente : Présenter les produits ou services de l'entreprise, répondre aux objections et conclure les ventes. Fidélisation : Assurer un suivi régulier des clients existants, gérer leurs demandes et les inciter à renouveler leurs achats. Reporting : Analyser les résultats de ses activités et rendre compte à sa hiérarchie.
+plus","Niveau d´études requis : Bac+1, Bac+2, Bac+3, Bac+4 & Bac+5 et plus; Niveau d'expérience : Etudiant, jeune diplômé et plus; Contrat proposé : CDI; Région de : Abidjan; Compétences clés : Gestion des Ventes - Négociation - Négociation Commerciale - Prospection - Vente"
Commercial - Abidjan,DSTOK,https://www.emploi.ci/offre-emploi-cote-ivoire/commercial-abidjan-1478215,"Nous sommes à la recherche des Commerciaux. Missions: Développer l'image de la plateforme en fesant des prospects auprès de particuliers et professionnels de la vente Organiser et optimiser vos tournées de clientèle Convaincre  les vendeurs de rejoindre la plateforme  Suivre et coatcher ces vendeurs pour qu'ils puissent entretenir leur compte régulièrement  Dynamiser les inscriptions et publications grâce à votre suivi rigoureux des vendeurs et des prospects Élaborer des reportings précis et réguliers pour la Direction marketing
+plus","Niveau d´études requis : Qualification avant bac, Bac, Bac+1, Bac+2, Bac+3, Bac+4 & Bac+5 et plus; Niveau d'expérience : Etudiant, jeune diplômé et plus; Contrat proposé : CDD, Freelance & Temps partiel; Région de : Abidjan; Compétences clés : Management - Marketing - Vente"
Développeur d´Application Web et Mobile - Abidjan,SIMPLE THREE,https://www.emploi.ci/offre-emploi-cote-ivoire/developpeur-application-web-mobile-abidjan-1477650,"L'équipe SIMPLE THREE recrute un Stagiaire Développeur d'Application Web et Mobile pour intégrer son équipe. Missions : Concevoir et développer des applications web évolutives et sécurisées. Collaborer avec notre équipe pour définir les besoins et les spécifications du projet. Assurer la maintenance et l'optimisation des applications existantes. Appliquer les meilleures pratiques en matière de développement pour garantir des performances élevées et une fiabilité accrue.
+plus","Niveau d´études requis : Bac+2, Bac+3, Bac+4 & Bac+5 et plus; Niveau d'expérience : Débutant < 2 ans et plus; Contrat proposé : CDD, Stage, Freelance & Temps partiel; Région de : Abidjan; Compétences clés : CMS - CODEIGNITER - CSS - HTML - IONIC - JAVASCRIPT - LARAVEL - MYSQL - NODE JS - NOSQL - PRESTASHOP - PYTHON - REACT - SQL - SWIFT - SYMFONY - WORDPRESS - XAMARIN"
Office Manager - Abidjan,FONDATION JEUNESSE NUMÉRIQUE,https://www.emploi.ci/offre-emploi-cote-ivoire/office-manager-abidjan-1477544,"Dans le cadre de la mise en place du pilote du Hub Ivoire Tech (HIT),  qui a pour ambition de créer le plus grand campus de startups et le meilleur écosystème entrepreneurial sous régional. La Fondation Jeunesse Numérique recherche actuellement un(e)  Office Manager  pour rejoindre son équipe. Missions : Rattaché à la Direction Exécutive de la Fondation Jeunesse Numérique, l’Office Manager occupe un poste polyvalent. Il est principalement en charge de (i)la gestion financière & administrative, (ii)la définition de l'offre de service, (iii)du recrutement, (iv)et l’arbitrage des priorités.  Il est le responsable de l'organisation et de l’atteinte des objectifs fixés au...
+plus",Niveau d´études requis : Bac+4 & Bac+5 et plus; Niveau d'expérience : Expérience entre 2 ans et 5 ans et plus; Contrat proposé : CDI; Région de : Abidjan; Compétences clés : Communication - Comptabilité - Dossiers Administratifs - Finance - Financement - Gestion - Gestion des Factures - Gestion Financière - Leadership - Management - Management d'Entreprise - Marketing - Rapports Financiers - Stratégie - Stratégie de Communication
Technicien en Électricité - Cocody,ENERG&TICS,https://www.emploi.ci/offre-emploi-cote-ivoire/technicien-electricite-cocody-1477062,"Entreprise exerçant principalement dans l'énergie, recrute un Technicien en Électricité. Mission : Effectuer des interventions sur site
+plus","Niveau d´études requis : Bac, Bac+1 & Bac+2; Niveau d'expérience : Etudiant, jeune diplômé & Débutant < 2 ans; Contrat proposé : Stage; Région de : Abidjan; Compétences clés : Production - Qualité"
Commercial Terrain H/F - Abidjan,TOP TÉLÉCOM SERVICES,https://www.emploi.ci/offre-emploi-cote-ivoire/commercial-terrain-hf-abidjan-1477177,"Nous recherchons plusieurs Commerciaux Terrain H/F dynamiques et motivés pour renforcer notre équipe de vente. Mission : Responsables du recrutement clients sur des zones géographiques définis.
+plus","Niveau d´études requis : Qualification avant bac, Bac, Bac+1 & Bac+2; Niveau d'expérience : Etudiant, jeune diplômé et plus; Contrat proposé : Freelance & Alternance; Région de : Abidjan; Compétences clés : Animation des Ventes - Négociation - Vente"
Directeur( Trice) des Opérations - Lomé,AFRICA CONSULTING LEADERS (ACL),https://www.emploi.ci/offre-emploi-cote-ivoire/directeur-trice-operations-lome-1499981,"Dans le cadre de notre développement, nous recherchons un(e ) Directeur( trice ) des Opérations. Nous connaitre Africa Consulting Leaders (ACL) est un opérateur de plateformes technologiques qui accompagne ses clients dans ses projets. Nous cumulons près de 30 ans d'expérience et fournissons aux ports et aux acteurs de la chaine logistique de transport des solutions digitales des plateformes métiers en environnement web associés à des outils FINTEC pour des services de paiement en ligne via des canaux de banque et mobile money. Nous accompagnons nos clients dans leurs activités en garantissant la permanence des services et la proximité à travers notre présence dans toute la sous-région....
+plus",Niveau d´études requis : Bac+5 et plus; Niveau d'expérience : Expérience entre 5 ans et 10 ans - Expérience > 10 ans; Contrat proposé : CDI - CDD; Région de : Abengourou - Abidjan - Aboisso - Adzopé - Agboville - Bondoukou -...; Compétences clés : Gestion - Gestion d'Équipe - Leadership - Management
Chargés de Clientèle Francophones - Treichville,MAJOREL,https://www.emploi.ci/offre-emploi-cote-ivoire/charges-clientele-francophones-treichville-1496031,"Nous sommes à la recherche des  Chargés de Clientèle Francophones. Missions  : Rattaché au Responsable du Groupe, le  Chargé de Clientèle est amené à répondre aux demandes d’informations, de renseignements ou de réclamations des clients. Énergique, il se doit toujours d'être souriant, aimable et dynamique. Le chargé de clientèle doit avoir le sens de l’écoute pour comprendre et résoudre les problèmes posés par ses interlocuteurs dans un délai raisonnable. Dès votre premier jour d’intégration au sein de l’entreprise, un accompagnement permanent vous sera octroyé. Une formation vous sera dispensée afin de vous apprendre les rudiments du métier et vous doter des compétences...
+plus","Niveau d´études requis : Bac; Niveau d'expérience : Etudiant, jeune diplômé & Débutant < 2 ans; Contrat proposé : Stage; Région de : Abidjan; Compétences clés : Accompagnement - Hôtellerie - Restauration - Tourisme - Vente"
Responsable Diagnostic Automobile - Abidjan,TOPWORK,https://www.emploi.ci/offre-emploi-cote-ivoire/responsable-diagnostic-automobile-abidjan-1494851,"Nous sommes à la recherche d'un  Responsable Diagnostic Automobile. Missions : Sous la supervision du Responsable du SAV / Directeur du SAV, le Responsable Diagnostic Automobile est chargé de : Superviser et coordonner les activités de diagnostic des véhicules au sein de l'atelier Évaluer les problèmes techniques signalés par les clients et établir un diagnostic précis et fiable Encadrer et former l’équipe de techniciens sur les nouvelles technologies, équipements de diagnostic et méthodes de travail Établir les process de diagnostic ainsi que les comptes rendus sur chaque véhicule S’assurer que l’équipe reste à jour sur les procédures et les protocoles de diagnostic spécifiques aux...
+plus",Niveau d´études requis : Bac+3; Niveau d'expérience : Expérience entre 5 ans et 10 ans & Expérience > 10 ans; Contrat proposé : CDI; Région de : Abidjan; Compétences clés : Diagnostic Électronique - Électromécanique - Électronique - Maintenance - Process - Production - Qualité
Contrôleur de Gestion - Abidjan,SNTCI,https://www.emploi.ci/offre-emploi-cote-ivoire/controleur-gestion-abidjan-1493327,"Société leader dans le domaine de la distribution des produits pétroliers, dans le cadre d'une vacance de poste recherche un Contrôleur de Gestion pour son siège à Abidjan. Missions : Assurer la production et l’analyse des indicateurs de suivi de la performance financière et opérationnelle de la société et coordonner le suivi de la trésorerie. Concevoir et piloter les indicateurs de gestion ;  Suivre l'évolution des résultats financiers de l’entreprise ; Participer à l’élaboration du budget et au suivi budgétaire ;  Participer à la rédaction du rapport de gestion mensuel permettant d’analyser l’évolution des activités de la société selon les instructions communiquées...
+plus",Niveau d´études requis : Bac+4 & Bac+5 et plus; Niveau d'expérience : Expérience entre 2 ans et 5 ans; Contrat proposé : CDI; Région de : Abidjan; Compétences clés : Audit - Comptabilité - Finance - Gestion - Suivi Budgétaire - Suivi de la Trésorerie - Trésorerie
Responsable Marketing Senior / Secteur : Fintech - Guinée,TOPWORK,https://www.emploi.ci/offre-emploi-cote-ivoire/responsable-marketing-senior-secteur-fintech-guinee-1492490,"Nous sommes à la recherche d'un  Responsable Marketing Senior / Secteur : Fintech. Missions : Collaborer avec la haute direction pour définir et exécuter la stratégie de marketing et de croissance de la division Fintech. Effectuer des études de marché et des analyses approfondies pour identifier les tendances, les opportunités et les perspectives concurrentielles. Créer et gérer des campagnes de marketing intégrées qui communiquent efficacement la proposition de valeur unique de nos produits et services Fintech. Superviser le développement de supports marketing, y compris le contenu numérique, les présentations, les livres blancs et d'autres supports promotionnels. Diriger les efforts de...
+plus",Niveau d´études requis : Bac+5 et plus; Niveau d'expérience : Expérience > 10 ans; Contrat proposé : CDI; Région de : International; Compétences clés : Développement du Produit - Marketing - SEO - Supports Marketing
Technico-commercial - Abidjan,INSTAHR,https://www.emploi.ci/offre-emploi-cote-ivoire/technico-commercial-abidjan-1487204,"Insta HR est une entreprise canadienne innovatrice axée sur la gestion des ressources humaines, mettant en avant l'agilité comme pilier fondamental de ses services. Nous offrons des solutions personnalisées et flexibles pour répondre aux besoins évolutifs des entreprises modernes. Nous sommes à la recherche d'un(e) Technico-commercial . e motivé(e) pour rejoindre notre équipe. Dans ce rôle, vous aurez la responsabilité de soutenir l'équipe de vente dans les tâches administratives, notamment dans la préparation de soumissions et la communication avec nos fournisseurs. Missions : Création de soumissions : Effectuer des recherches et préparer des devis détaillés en fonction des besoins des clients, en...
+plus",Niveau d´études requis : Bac+3; Niveau d'expérience : Expérience entre 2 ans et 5 ans; Contrat proposé : CDI; Région de : Abidjan; Compétences clés : ASTM - AUTOCAD - BTP - Communication - Maintenance - Métallurgie - Production - Qualité
Technicien H/F,NEEMBA,https://www.emploi.ci/offre-emploi-cote-ivoire/technicien-hf-1096948,"Nous sommes à la recherche d'un  Technicien H/F. Vos principales missions  : Contrôler et mesurer à partir de plans ou de schémas (tension, intensité, isolement, température), nettoyer, resserrer et remplacer différents organes sur des machines ou groupes électrogènes Préparer les interventions à l'aide de dossiers de construction et de maintenance Procéder aux contrôles prévus dans le programme de maintenance, mesures, vérification du serrage des bornes de connexion… Effectuer les tâches d'entretien nécessaire ou les réparations Effectuer les tests réglementaires de remise en service.
+plus",Niveau d´études requis : Bac+2; Niveau d'expérience : Débutant < 2 ans; Contrat proposé : CDI & CDD; Région de : Abidjan; Compétences clés : Automatisme - BTP - Construction - Électromécanique - Électrotechnique - Énergie - Gaz - Machines - Maintenance - Nucléaire - Production - Qualité
General Financial Manager - Accra Ghana,AFRICAWORK,https://www.emploi.ci/offre-emploi-cote-ivoire/general-financial-manager-accra-ghana-1484638,"We are recruiting for our client specialized in production and processing of natural raw materials used in cosmetic and food industries, a  General Financiel Manager  in  Accra  (Ghana) responsible of supervising and improving all elements of the financial management, accounting, closing, and reconciliation processes.   Responsabilities : • Compile all information needed to build a regular and concise reporting framework that highlights key financial and operational performance metrics, including sales and profitability by customer and channel, trade spend performance, and other KPIs. • Work with the Finance Department team and the Internal Auditor to prepare a monthly financial reporting...
+plus",Niveau d´études requis : Bac+5 et plus; Niveau d'expérience : Expérience > 10 ans; Contrat proposé : CDI; Région de : International; Compétences clés : Leadership - Management
Business Developer - Abidjan,TOPWORK,https://www.emploi.ci/offre-emploi-cote-ivoire/business-developer-abidjan-1484658,"Nous sommes à la recherche d'un  Business Developer. Missions : Identifier et prospecter de nouveaux clients (entreprises). Créer et entretenir des relations solides avec les clients existants et potentiels. Proposer et négocier des contrats de services en adéquation avec les besoins des clients.  Mettre en place des partenariats stratégiques pour renforcer la présence de la filiale. Identifier les opportunités de croissance sur de nouveaux secteurs et anticiper les tendances du marché de l’emploi. Travailler en étroite collaboration avec les consultants en recrutement et l'équipe Administrative et Paie pour aligner les offres sur les besoins du marché. Suivre les performances...
+plus","Niveau d´études requis : Bac+3, Bac+4 & Bac+5 et plus; Niveau d'expérience : Expérience entre 2 ans et 5 ans et plus; Contrat proposé : CDI & CDD; Région de : Abidjan; Compétences clés : CRM - Développement Commercial - Négociation - Négociation Commerciale - Prospection - Vente"
Ingénieur Développeur Logiciel JEE Langage C/C++ - Abidjan,PRIME CONSULTING,https://www.emploi.ci/offre-emploi-cote-ivoire/ingenieur-developpeur-logiciel-jee-langage-cc-abidjan-1483058,"Nous sommes à la recherche des  Ingénieurs Développeur Logiciel JEE Langage C/C++ Missions : Rattaché(e) au Directeur des projets et services, vos principales missions dans une petite équipe de six (06) personnes seront : Développer les produits informatiques et monétique en JEE ; Réaliser l’analyse technique et l’étude détaillée des projets ; Contribuer à la définition des spécifications générales ; Adapter et paramétrer les progiciels applicatifs ; Réaliser le prototypage des applications ; Pratiquer les tests usines (et chez le client final) pour la validation du produit ; Identifier et traiter les dysfonctionnements ; Réaliser et assembler les objets et composants...
+plus","Niveau d´études requis : Bac+3, Bac+4 & Bac+5 et plus; Niveau d'expérience : Débutant < 2 ans; Contrat proposé : CDI & CDD; Région de : Abidjan; Compétences clés : AJAX - APACHE - C++ - CSS - ECLIPSE - HIBERNATE - HTML - HTTP - JAVA - JSP - LINUX - MYSQL - ORACLE - SPRING - Technicité - TOMCAT - UNIX - XML"
Consultant Junior Inphb - Abidjan,AFRICAWORK,https://www.emploi.ci/offre-emploi-cote-ivoire/consultant-junior-inphb-abidjan-1483393,"Missions principales  : En tant que  Consultant junior,  vous travaillerez en équipe avec les consultants de la structure, vous épaulerez aussi le développeur dans ses tâches. Vous travaillerez sous la supervision d'un Consultant Senior. Vos missions principales incluront : Analyse et diagnostic  : Collecte et analyse de données (interviews, études de marché, benchmarks). Identification des problèmes et des opportunités d'amélioration. Conception des logiciels en fonction des besoins des clients.   Recommandations  : Participation à l'élaboration de solutions adaptées aux besoins du client. Rédaction de rapports et de présentations avec des recommandations stratégiques...
+plus","Niveau d´études requis : Bac+3, Bac+4 & Bac+5 et plus; Niveau d'expérience : Débutant < 2 ans et plus; Contrat proposé : CDD; Région de : Abidjan; Compétences clés : MS PROJECT"
Assistant(e) Administratif(ve) - Abidjan,NEEMBA,https://www.emploi.ci/offre-emploi-cote-ivoire/assistante-administratifve-abidjan-1482408,"Nous sommes à la recherche d'un(e)  Assistant(e) Administratif(ve). Missions : Gérer les bases de données des clients OGM : Alimenter un fichier clients OGM en Côte d’Ivoire et OFFSHORE (Europe/USA) Partager cette base de données avec le guichet OGM de JADELMAS Prospecter les clients, suivre la concurrence, mesurer le marché et établir le budget annuel (Sous supervision du Responsable régional OGM : Établir les rapports de visite et les plans d’action Assurer le tracking des navires (logiciel, géolocalisation) Suivre la concurrence, repérer les livraisons des pièces CAT par les concurrents Réclamer les CES à CAT sur les pièces vendues par les concurrents Mesurer le marché...
+plus","Niveau d´études requis : Bac+2, Bac+3, Bac+4 & Bac+5 et plus; Niveau d'expérience : Etudiant, jeune diplômé & Débutant < 2 ans; Contrat proposé : CDD; Région de : Abidjan; Compétences clés : Conseil - Formation - Hydraulique - Hydraulique Mécanique - Mécanique - Mécanique Électrique - Mécanique Hydraulique - Production - Productivité - Qualité - Réception"
Responsable Production / Secteur : Production Vins & Spiritueux - Conakry,TOPWORK,https://www.emploi.ci/offre-emploi-cote-ivoire/responsable-production-secteur-production-vins-spiritueux-conakry-1482679,"Nous sommes à la recherche d'un  Responsable Production dans le secteur Production Vins & Spiritueux. Missions : Veiller au maintien en bon état de marche des équipements industriels et à la réalisation de la production suivant les normes généralement admises ; Élaborer les spécifications techniques des équipements à acquérir ; Élaborer les cahiers des charges et le dossier de commande pour les équipements concernés ; Manager les équipes de production et de maintenance ; Assurer le bon déroulement de la production ; Contrôler le fonctionnement des machines de manières permanente ; Réaliser la maintenance préventive suivant les préconisations du fabriquant des équipements ou du planning de...
+plus",Niveau d´études requis : Bac+4 & Bac+5 et plus; Niveau d'expérience : Expérience entre 5 ans et 10 ans & Expérience > 10 ans; Contrat proposé : CDI; Région de : International; Compétences clés : Gestion de la Production - Gestion de la Qualité - Machines - Maintenance - Maintenance Préventive - Production - Qualité
Commercial Matériels Lourds - Abidjan,NEEMBA,https://www.emploi.ci/offre-emploi-cote-ivoire/commercial-materiels-lourds-abidjan-1435058,"Nous sommes à la recherche d'un  Commercial Matériels Lourds. Missions : Faire la prospection et le démarchage clients, assurer le suivi des commandes. Organiser les visites de suivi clientèle, organiser les relances clients. Mettre à jour et assurer un mailing commercial pour le portefeuille des entreprises TP. Répondre aux appels d'offres et participer à l’élaboration des dossiers de soumission. Effectuer le suivi du portefeuille client et des commandes : assurer la traçabilité jusqu’à la livraison des matériels et au règlement conforme. Assurer la satisfaction des clients, l’interface entre les services et les clients dédiés, et la gestion du stock de matériel. Participer à la...
+plus","Niveau d´études requis : Bac+3, Bac+4 & Bac+5 et plus; Niveau d'expérience : Débutant < 2 ans et plus; Contrat proposé : CDD; Région de : Abidjan; Compétences clés : Communication - Mailing - Marketing - Négociation - Plan Marketing - Prospection - Vente"
Agent Commercial - Bouaké,VISION PLUS VOYAGES,https://www.emploi.ci/offre-emploi-cote-ivoire/agent-commercial-bouake-1484311,"Nous recherchons pour nos besoins de service des profils d' Agent Commercial  sur la ville de  Bouaké . Missions  : Développer le portefeuille client avec les objectifs en termes de volume d'activité et de revenu Être le point focal du client sur les différents produits et services de l'entreprise Construire des relations durables et mutuellement bénéfiques entre les clients et l'entreprise Élaborer et exécuter des plans d'actions commerciales pour les clients existants et les prospects en plus du suivi client Participer activement au projet d'amélioration continue de l'entreprise.
+plus","Niveau d´études requis : Bac+3, Bac+4 & Bac+5 et plus; Niveau d'expérience : Expérience entre 2 ans et 5 ans et plus; Contrat proposé : CDD; Région de : Bouaké; Compétences clés : Actions Commerciales - Communication - Gestion Marketing - Marketing - Vente"
